issue_id,issue_date,selected,region,category,title,summary,why_it_matters,url,source,published_at,one_liner,verification_status,notes
2026-05-19-11,2026-05-19,no,korea,news,키보토스 런 2026 예매 7분 만에 매진…게임 IP 러닝 이벤트 수요 확인,"파이낸셜뉴스는 5월 18일 넥슨 블루 아카이브 기부 러닝 이벤트 키보토스 런 2026 참가권이 오후 2시 예매 시작 뒤 7분 만에 매진됐다고 보도했습니다. 행사는 6월 14일 경기 하남 미사경정공원에서 열리며 4,500명 규모 5km 코스로 운영됩니다. 전자신문 보도 기준 포토존, 굿즈 부스, 코스프레 이벤트, DJ 공연도 함께 마련됩니다.",이제 이 소식은 접수 안내가 아니라 러닝 이벤트 트렌드로 봐야 합니다. 인기 IP와 5K가 결합하면 기록형 대회와 다른 수요가 빠르게 움직인다는 신호입니다.,https://www.fnnews.com/ampNews/202605181549274998,파이낸셜뉴스,2026-05-18,"키보토스 런 7분 매진, IP 러닝은 접수 속도가 다릅니다.",reviewed,파이낸셜뉴스 매진 보도와 전자신문 개최 기사 교차 확인. 기존 후보의 오늘 접수 시작 관점은 매진 이후 부적합하여 수정.
2026-05-19-11,2026-05-19,yes,global,safety,"더운 날 페이스보다 체감강도 기준…러너스월드, 여름 러닝 강도 조절법 정리","Runner's World는 5월 17일 더위와 습도가 평소 페이스를 더 힘들게 만드는 이유를 정리했습니다. 기사에서는 더운 날 같은 페이스를 고집하기보다 RPE 기준으로 강도를 맞추고, 쉬운 달리기는 말이 되는 수준의 4/10 정도 노력감으로 유지하라고 설명합니다. 체감 열감이 8~10 수준이면 달리기를 멈추고 그늘에서 식히며 수분을 보충하라는 기준도 제시했습니다.",국내도 5월 말부터 낮 기온과 습도가 빠르게 올라갑니다. 봄 대회 페이스를 여름 훈련에 그대로 가져가면 쉬운 달리기도 과훈련이 될 수 있습니다.,https://www.runnersworld.com/training/a71318220/running-intensity-in-heat/,Runner's World,2026-05-17,더운 날은 페이스가 아니라 체감강도 4/10을 기준으로.,reviewed,Runner's World 5/17 기사 확인. WHOOP 2월 글을 대체할 최근 안전/훈련 후보.
2026-05-19-11,2026-05-19,no,global,training,첫 5K는 숫자로 쪼개면 작아진다…입문 러너용 목표 설정법,"Runner's World는 5월 18일 첫 5K가 생각보다 접근 가능한 목표라는 관점의 훈련 글을 업데이트했습니다. 기사에서는 3.1마일이라는 거리를 주차, 분, 마일 같은 작은 숫자로 쪼개면 초보 러너가 목표를 현실적으로 볼 수 있다고 설명합니다. 시작점에 따라 고를 수 있는 5K 훈련 계획도 함께 소개했습니다.",국내 후보에도 5K 이벤트가 많아지고 있습니다. 처음 대회에 나가는 독자에게는 장비보다 목표를 작게 나누는 방식이 참가 장벽을 낮춥니다.,https://www.runnersworld.com/training/a71337160/5k-training-data-by-the-numbers/,Runner's World,2026-05-18,첫 5K는 3.1마일을 작은 훈련 단위로 쪼개는 것부터.,reviewed,Runner's World 5/18 기사 확인. 국내 5K 이벤트 증가와 연결 가능한 입문 훈련 후보.
2026-05-21-12,2026-05-21,yes,korea,event,"홍천사랑마라톤 5월 19일 접수 시작…10월 4일 하프·10K·5K 운영","2026 홍천사랑마라톤은 10월 4일 홍천종합운동장에서 열립니다. 마라톤GO 기준 하프, 10km, 5km 세 종목이고 접수 기간은 5월 19일부터 8월 31일까지입니다. 공개 안내에는 5월 19일 오후 2시 접수 시작으로 표시돼 있습니다.","가을 강원권 대회를 미리 잡으려는 러너에게 선택지가 하나 더 생겼습니다. 접수 기간은 길지만 숙박과 이동이 필요한 지역 대회라 일정을 먼저 고정하는 편이 좋습니다.",https://marathongo.co.kr/raceDetail/domestic/2026-hongcheon-sarang-marathon,마라톤GO,2026-05-19,"홍천사랑마라톤, 10월 강원권 목표 대회 접수 시작.",reviewed,"마라톤GO에서 대회일, 장소, 종목, 접수 기간, 접수 시작 문구 확인."
2026-05-21-12,2026-05-21,yes,korea,event,"부산 송도해안트레일런 6월 13일 개최…13K 선착순 50명","부산 송도해안트레일런은 6월 13일 남항대교 수변야외공연장에서 오전 8시에 출발합니다. EnduroHub 기준 13km 단일 종목이며 신청은 6월 12일 17시까지, 참가 인원은 입금자 선착순 50명으로 제한됩니다. 참가비는 2만9천500원으로 안내돼 있습니다.","대형 트레일 대회가 부담스러운 부산권 러너에게 짧고 작은 해안 트레일 선택지입니다. 모집 인원이 적어 관심 있다면 코스 난도와 환불 가능일을 바로 확인해야 합니다.",https://www.endurohub.kr/races/%EB%B6%80%EC%82%B0-%EC%98%81%EB%8F%84%ED%8A%B8%EB%A0%88%EC%9D%BC%EB%9F%B0,EnduroHub,2026-05-20,"송도해안트레일런, 13K 소규모 해안 트레일.",reviewed,"EnduroHub에서 일정, 장소, 코스, 신청 마감, 선착순 50명, 참가비, 제한시간 확인."
2026-05-21-12,2026-05-21,yes,korea,event,"버닝런 2026 대체공휴일 여의도 개최…5K·7K·10K 순차 출발","버닝런 2026은 5월 25일 서울 여의도 한강공원 물빛무대에서 열립니다. KorMarathon 기준 5km, 7km, 10km 세 종목이고 참가비는 각각 3만5천원, 4만원, 4만5천원입니다. 행사장 집결은 오전 8시, 출발은 8시 30분부터 순차 진행으로 안내돼 있습니다.","연휴 마지막 날 한강 레이스라 참가자는 교통, 물품보관, 더위 대응을 미리 점검해야 합니다. 7K와 10K는 기록칩이 제공돼 가벼운 기록 점검용으로도 볼 수 있습니다.",https://www.kormarathon.com/ko/races/burning-run-2026,KorMarathon,2026-05-21,"버닝런, 5/25 여의도 5K·7K·10K 운영.",reviewed,"KorMarathon에서 대회일, 장소, 종목, 참가비, 출발 운영, 기록칩 안내 확인."
2026-05-21-12,2026-05-21,yes,korea,event,"야반도주 in Busan 5월 30일 북항 야간 10K…선착순 3천명","2026 야반도주 in Busan은 5월 30일 부산 북항친수공원 잔디마당에서 저녁 7시 30분 열리는 10km 야간 레이스입니다. KorMarathon 기준 참가비는 6만원이고 부산일보가 주최하며 위즈런 솔루션이 운영사무국을 맡습니다. 공개 안내에는 온라인 접수, 선착순 3천명, 기록칩과 야광 팔찌 등 기념품이 표시돼 있습니다.","야간 레이스는 낮 대회와 준비가 다릅니다. 부산 참가자는 조명, 귀가 동선, 저녁 식사와 수분 섭취 시간을 따로 계획해야 합니다.",https://www.kormarathon.com/ko/races/2026-midnight-road-race-in-busan,KorMarathon,2026-05-21,"부산 야반도주, 북항 10K는 저녁 루틴이 핵심.",reviewed,"KorMarathon에서 일정, 장소, 출발 시간, 참가비, 선착순 규모, 주최·운영 정보 확인."
2026-05-21-12,2026-05-21,no,korea,event,"제31회 바다의날 마라톤 5월 23일 상암 개최…하프·10K·5K 운영","제31회 바다의날 마라톤대회는 5월 23일 서울 상암동 평화의공원 평화광장에서 열립니다. KorMarathon 기준 하프, 10km, 5km 세 종목으로 운영됩니다. 접수는 이미 마감됐고 공식 홈페이지는 badamarathon.com으로 연결됩니다.","참가자는 발행 이틀 뒤 바로 대회장에 서게 됩니다. 상암권 행사는 교통 혼잡이 잦으니 집결 시간, 물품보관, 귀가 동선을 전날 확정하는 것이 좋습니다.",https://www.kormarathon.com/ko/races/the-31th-ocean-day-marathon,KorMarathon,2026-05-21,"바다의날 마라톤, 상암 참가자는 대회 전 동선 점검.",reviewed,"KorMarathon에서 대회일, 장소, 종목, 접수 마감 상태, 공식 홈페이지 연결 확인."
2026-05-21-12,2026-05-21,no,korea,event,"hy 하루런 5월 23일 미사경정공원 개최…10K는 기록칩 제공","2026 hy 하루런 마라톤대회는 5월 23일 경기 미사경정공원 광장에서 열립니다. KorMarathon 기준 5km 참가비는 4만원, 10km 참가비는 4만5천원이며 10km 참가자는 기록칩으로 기록 측정이 이뤄집니다. 대회 당일 셔틀버스 운행도 안내돼 있습니다.","미사권 5K, 10K 참가자는 기록 측정 여부와 셔틀 동선을 먼저 확인해야 합니다. 5K는 기록칩이 없으므로 기록 목표보다 가벼운 완주 이벤트로 보는 편이 맞습니다.",https://www.kormarathon.com/ko/races/2026-hy-harurun-marathon,KorMarathon,2026-05-21,"hy 하루런, 5K와 10K 기록 운영 차이를 확인.",reviewed,"KorMarathon에서 일정, 장소, 종목별 참가비, 5K 기록칩 미제공, 10K 기록 측정, 셔틀 안내 확인."
2026-05-21-12,2026-05-21,no,korea,event,"분노의질주런 용인스피드웨이 5월 23일 개최…서킷 1랩·3랩 운영","2026 분노의질주런 용인스피드웨이는 5월 23일 에버랜드 스피드웨이에서 열립니다. KorMarathon 기준 1 Lap 이벤트 런은 4.34km, 3 Laps는 13.04km로 운영되고 3 Laps는 10km 구간 기록 측정도 제공합니다. 참가비는 GS Pay 혜택가와 일반가가 나뉘어 안내돼 있습니다.","자동차 서킷을 달리는 이색 레이스라 노면과 햇빛 노출이 일반 도로와 다를 수 있습니다. 참가자는 기록 욕심보다 페이스 조절과 보급 위치를 먼저 챙겨야 합니다.",https://www.kormarathon.com/ko/races/2026-fast-and-furious-run,KorMarathon,2026-05-21,"용인스피드웨이 서킷런, 1랩과 3랩 운영 방식 확인.",reviewed,"KorMarathon에서 대회일, 장소, 1 Lap·3 Laps 거리, 10km 기록 측정, 참가비 구간 확인."
2026-05-21-12,2026-05-21,no,korea,event,"달려용,인 RUN FESTA 5월 23일 용인 개최…5K·10K 생활체육 레이스","달려용,인 2026 RUN FESTA는 5월 23일 경기도 용인시 처인구 경안천로 76 일대에서 열립니다. KorMarathon 기준 5km와 10km 두 종목이며 참가비는 5km 4만원, 10km 4만5천원입니다. 주최는 한국외국어대학교 글로벌스포츠산업학부로 안내돼 있습니다.","같은 날 수도권에 여러 러닝 행사가 몰려 있어 참가자는 자기 대회명을 정확히 확인해야 합니다. 용인권 러너에게는 접근성 좋은 5K, 10K 완주 이벤트입니다.",https://www.kormarathon.com/ko/races/dallyeoyongin-2026-run-festa,KorMarathon,2026-05-21,"달려용인 RUN FESTA, 용인 5K·10K 현장 동선 확인.",reviewed,"KorMarathon에서 대회일, 장소, 종목, 참가비, 주최 정보 확인."
2026-05-21-12,2026-05-21,yes,global,event,"대형 마라톤 추첨 탈락 대안…목표 대회보다 목표 경험을 먼저 정하기","Runner's World는 5월 18일 월드 마라톤 메이저 같은 대형 대회 추첨에 떨어졌을 때의 대응법을 다뤘습니다. 기사에서는 2026 런던마라톤 퍼블릭 볼럿에 100만 명 이상이 신청했고 실제 참가 규모는 6만 명 수준이라고 설명합니다. 여행사, 자선 참가, 자원봉사, 작은 대회로 목표를 재설계하는 방법도 함께 제안했습니다.","해외 메이저 대회를 꿈꾸는 국내 러너에게도 현실적인 조언입니다. 특정 도시보다 기록, 여행, 경쟁, 완주 경험 중 무엇이 목표인지 먼저 정하면 대체 대회 선택이 쉬워집니다.",https://www.runnersworld.com/races-places/a71318334/world-marathon-major-race-alternatives/,Runner's World,2026-05-18,"메이저 추첨 탈락도 시즌 목표를 다시 짜는 계기.",reviewed,"Runner's World 5/18 기사 확인. 런던마라톤 신청 규모, 6만 명 참가 규모, 대체 진입 경로와 목표 재설계 관점 정리."
2026-05-21-12,2026-05-21,no,global,training,"크리티컬 벨로시티 훈련 주목…젖산역치보다 살짝 빠른 지속 가능 인터벌","Runner's World는 5월 16일 critical velocity 훈련을 소개했습니다. 기사에서는 CV를 젖산역치보다 약간 빠르고 VO2max 전력주보다 낮은 강도로 설명하며, 초보자는 총 12~15분, 중급자는 18~21분, 상급자는 21~24분 정도를 CV 페이스로 나눠 달리는 방식을 제안했습니다. 예시로 중급 러너에게 3분 반복주 6~7회와 1분 회복을 제시했습니다.","여름으로 넘어가는 시기에는 무작정 전력 인터벌을 늘리기보다 회복 가능한 속도 훈련이 유용합니다. 5K부터 마라톤까지 기록을 노리는 러너가 주 1회 품질훈련으로 검토할 만합니다.",https://www.runnersworld.com/training/a71310980/critical-velocity-workouts/,Runner's World,2026-05-16,"CV 훈련, 숨이 무너지기 전 속도로 꾸준히 빠르게.",reviewed,"Runner's World 5/16 기사 확인. CV 정의, 총 훈련 시간, 3분 반복주 예시, 적용 거리 중심으로 정리."
