issue_id,issue_date,selected,region,category,title,summary,why_it_matters,url,source,published_at,one_liner,verification_status,notes
2026-04-25-01,2026-04-25,yes,korea,event,서울하프마라톤 개최…26일 광화문~상암 도심 일부 통제,"서울시는 4월 26일(일) 오전 7시 30분 광화문광장을 출발해 여의도공원(10km), 상암 월드컵공원 평화광장(하프)으로 이어지는 '2026 서울하프마라톤대회'를 개최한다고 안내했습니다. 시 발표 기준 참가자는 총 2만2천 명이며, 대회 당일 오전 7시 20분부터 10시 30분까지 코스 구간별 교통 통제가 이뤄집니다(광화문광장 주변은 5시부터 통제).","대회 참가자는 레이스 당일 이동, 집결 동선과 통제 시간을 미리 잡을 수 있고, 비참가 러너/시민도 주말 장거리, 롱런 코스(광화문~한강~마포권) 계획을 조정할 수 있습니다.",https://www.seoul.go.kr/news/news_report.do?nttNo=456772&srchCtgry=466,서울특별시,2026-04-25,4/26 서울하프: 통제 7:20~10:30 체크!,reviewed,01호 발행 콘텐츠.
2026-04-25-01,2026-04-25,yes,korea,event,"하트시그널 러닝 페스타, 2차 추가 접수 4/27 23:59까지","공식 홈페이지에 따르면 '하트시그널 러닝 페스타'는 5월 3일(일) 07:30 서울 마포구 문화비축기지에서 열리며, 10km 종목(참가비 7만원)으로 진행됩니다. 2차 추가 접수는 4월 20일(월) 14:00부터 4월 27일(월) 23:59까지로 표시돼 있고, 2차 추가 접수자는 참가자 키트를 현장에서 수령합니다.","기록 경쟁보다 '러닝+콘셉트형 체험'에 가까워, 혼자 달리는 러너도 이벤트 분위기를 즐기며 달릴 수 있는 선택지입니다. 마감 시간이 명확해(4/27 23:59) 막판 접수 수요가 생기기 쉬워요.",https://heartsignalrunfesta.com/,하트시그널 러닝 페스타(공식),2026-04-24,"하시런페 2차 접수, 4/27 23:59 마감.",reviewed,01호 발행 콘텐츠.
2026-04-25-01,2026-04-25,yes,korea,event,'무한도전 Run with 쿠팡플레이' 6/7 개최…접수는 5/7 하루,"세계일보(4/24 보도)에 따르면 '무한도전 Run with 쿠팡플레이'가 6월 7일 서울 상암 문화비축기지에서 10km 코스로 열립니다. 대회 정보 페이지에는 접수기간이 5월 7일 하루(선착순)로 표시돼 있으며, 주최는 MBC, 쿠팡플레이로 안내됩니다.","인기 IP, 콘셉트형 러닝은 접수 당일 빠르게 마감되는 경우가 많습니다. 5/7 하루 접수로 표시돼 있어, 관심 러너라면 알림, 결제수단을 미리 준비해두는 게 안전합니다.",https://www.kormarathon.com/ko/races/2026-infinite-challenge-run-with-coupang-play,KorMarathon,2026-04-24,"무도런 6/7, 접수는 5/7 '하루' 표기.",reviewed,01호 발행 콘텐츠.
2026-04-25-01,2026-04-25,yes,global,elite,"사베스티안 사웨, 런던 마라톤서 '세계기록 도전' 전망","가디언(4/24) 보도에 따르면 2026 런던 마라톤에서 사베스티안 사웨가 남자 마라톤 세계기록(2:00:35) 페이스를 노릴 수 있다는 관측이 나왔습니다. 기사에서는 사웨가 아디다스의 초경량 레이싱화(Pro Evo 3)를 착용할 예정이며, 제이컵 키플리모, 타미랏 톨라 등 강한 남자 엘리트 라인업이 함께 언급됩니다.",한국 러너에게도 '레이스 전개(페이스메이킹/날씨/경쟁 구도)'가 기록에 어떻게 영향을 주는지 참고가 됩니다. 메이저 마라톤 관전 포인트를 잡아두면 훈련 동기부여에도 도움이 됩니다.,https://www.theguardian.com/sport/2026/apr/24/silent-assassin-sabastian-sawe-targets-world-record-in-london-marathon,The Guardian,2026-04-24,"런던마라톤, 남자 세계기록 페이스가 나올까?",reviewed,01호 발행 콘텐츠.
2026-04-25-01,2026-04-25,yes,global,gear,"아디다스, 97g 'Adizero Adios Pro Evo 3' 공개…4/25부터 제한 판매","아디다스는 4월 23일(현지 릴리즈) 'Adizero Adios Pro Evo 3'를 공개하며 평균 97g의 초경량 슈퍼슈즈라고 밝혔습니다. 공식 발표에는 이전 모델 대비 30% 경량화, 11% 더 큰 앞발 에너지 리턴, 1.6% 러닝 이코노미 개선 등의 수치가 포함돼 있고, 4월 25일부터 adidas.com 및 일부 리테일러에서 제한 수량으로 판매한다고 안내합니다.",슈퍼슈즈의 '경량화 경쟁'은 엘리트뿐 아니라 일반 러너의 레이스데이 슈즈 선택에도 영향을 줍니다. 판매 방식(제한 수량/특정 채널)까지 명시돼 있어 국내 구매 가능성, 리셀 리스크를 가늠하는 데도 도함이 됩니다.,https://news.adidas.com/running/adidas-unveils-its-first-sub-100-gram-supershoe--the-adizero-adios-pro-evo-3/s/ded7b6a2-952a-4246-b675-4129f78787c4,adidas News,2026-04-23,"97g 슈퍼슈즈, 4/25 제한 판매 시작.",reviewed
2026-04-28-02,2026-04-28,yes,korea,event,"컬처런 6/13 영종도, 선착순 5천 명 접수 5월 1일 마감","6월 13일 인천 영종도 씨사이드파크에서 열리는 컬처런 2026의 참가 접수가 5월 1일에 마감됩니다. 하프코스, 10km, 5km 세 종목으로 운영되며, 선착순 5,000명을 모집합니다. 참가비는 하프, 10km 5만원, 5km 4만원이며 인천 중구 시민은 5천원 할인이 적용됩니다.",접수 마감이 사흘 남았습니다. 6월 대회를 찾는 러너라면 지금 바로 확인하고 결정해야 합니다. 영종도 해안 코스라 섬으로 이동하는 동선도 미리 잡아두는 게 좋습니다.,https://culturerun.net/apply/apply.php,컬처런 공식,2026-04-28,"컬처런 접수 5/1 마감, 영종도 5천 명",reviewed,02호 발행 콘텐츠.
2026-04-28-02,2026-04-28,yes,korea,event,"iM뱅크 코리아오픈마라톤 6월 7일 여의도, 추첨 접수 5월 10일 마감","iM뱅크가 시중은행 전환 2주년을 기념해 6월 7일 서울 여의도공원에서 코리아오픈마라톤을 개최합니다. 하프, 10km, 5km 종목으로 총 8,000명을 추첨으로 선발하며, 접수는 5월 10일까지 공식 홈페이지에서 진행합니다.","여의도공원 출발로 교통 접근성이 좋고, 추첨제라 선착순 광클 부담이 없습니다. 5월 10일까지 여유가 있어 보이지만 신청을 잊으면 기회가 없으니 일정에 미리 표시해두는 게 좋습니다.",https://imrun.kr/marathon/code/8046/,iM뱅크 마라톤 공식,2026-04-28,"iM뱅크 마라톤 6/7 여의도, 추첨 5/10",reviewed,02호 발행 콘텐츠.
2026-04-28-02,2026-04-28,yes,korea,news,"봄 29도 마라톤, 파주서 참가자 12명 온열 증상",4월 파주에서 열린 임진각 DMZ 평화 마라톤 대회에서 낮 최고기온 29도 폭염 속에 참가자 12명이 온열 증상으로 쓰러졌습니다. 봄이라도 기온이 갑자기 오르는 날에는 대회 현장에서 빠르게 대처하지 않으면 위험해질 수 있습니다.,"5, 6월 대회를 앞두고 있다면 기온 체크, 페이스 조절, 수분 보충 계획을 미리 세워두세요. 출발 전날까지 기상 예보를 반드시 확인하고, 더운 날은 평소보다 15~20초 느린 페이스로 시작하는 게 안전합니다.",https://www.mt.co.kr/society/2026/04/20/2026042014515122864,머니투데이,2026-04-20,"봄 29도 마라톤, 12명 쓰러져 주의",reviewed,02호 발행 콘텐츠.
2026-04-28-02,2026-04-28,yes,global,event,싱가포르 국제마라톤 접수 오픈…풀코스 ,"BYD 싱가포르 국제마라톤 2026의 참가 접수가 시작됐습니다. 현지인 기준 풀코스 참가비는 188싱가포르달러(약 18만원), 해외 러너는 208싱가포르달러(약 20만원)입니다.","서울에서 직항으로 접근하기 좋은 아시아 대형 마라톤 중 하나입니다. 야간 레이스로 진행돼 열기 부담이 덜하고, 아시아권 원정을 계획 중인 러너라면 접수 초기에 확인해두는 게 유리합니다.",https://www.asiaone.com/singapore/registration-open-byd-singapore-international-marathon-adidas-standard-chartered,AsiaOne,2026-04-27,"싱가포르마라톤 접수 오픈, 풀코스 ",reviewed,02호 발행 콘텐츠. Google News RSS 래핑 링크를 AsiaOne 최종 원문 URL로 교체.
2026-04-28-02,2026-04-28,yes,global,elite,"아세파, 런던마라톤 여자 세계기록 2:15:41","에티오피아의 티그스트 아세파가 4월 26일 2026 런던마라톤 여자 부문에서 2시간 15분 41초를 기록하며 자신이 보유한 여성 단독 세계기록을 9초 단축했습니다. 35km 이후 스퍼트로 2위 오비리(2:15:53)를 12초 차로 제쳤고, 이날 2:16 이내로 세 명이 동시에 들어온 건 역사상 처음입니다.","사웨(남자 sub-2)와 같은 날 여자 부문도 역사가 새로 씌었습니다. 페이스메이킹, 기후 조건, 슈즈 기술이 어떻게 맞물리면 기록이 나오는지 엘리트 레이스에서 배울 점이 있습니다.",https://www.londonmarathonevents.co.uk/london-marathon/article/tigst-assefa-smashes-women-only-world-record-historic-tcs-london-marathon,London Marathon Events,2026-04-26,"아세파, 여자 세계기록 2:15:41 런던",reviewed,02호 발행 콘텐츠.
2026-04-30-03,2026-04-30,yes,korea,event,2026 푸른하늘런 6/6 상암 개최…접수 5월 28일 마감,"6월 6일 현충일 서울 상암 월드컵공원 평화광장에서 '2026 푸른하늘런'이 열립니다. 하프, 10km, 5km 세 종목으로 운영되며, 접수는 5월 28일까지 진행됩니다. 참가비는 전 종목 5만원입니다.",현충일에 서울에서 달릴 수 있는 접근성 좋은 대회입니다. 6월 초 대회를 찾는 러너라면 접수 마감 전에 일정과 이동 동선을 확인해두세요.,https://blueskyrun.kr/,푸른하늘런 공식,,"현충일 상암 달리기, 접수 5/28 마감",reviewed,6/6 상암 월드컵공원 평화광장. 5km
2026-04-30-03,2026-04-30,yes,korea,event,송도 이봉주 마라톤 6/28 첫 개최…1만 명 선착순 모집,"제1회 송도 이봉주 마라톤이 6월 28일 인천대학교 송도캠퍼스 일원에서 열립니다. 10km와 5km 두 종목으로 운영되며, 참가비는 모두 5만원입니다. 공식 홈페이지 기준 참가 인원은 1만 명 선착순입니다.","수도권에서 접근 가능한 새 대회이고, 이봉주 선수 이름을 내건 첫 회 행사라 관심이 몰릴 수 있습니다. 6월 말 5km, 10km 대회를 찾는 러너에게 좋은 선택지입니다.",https://runsongdo.co.kr/,송도 이봉주 마라톤 공식,,"송도 이봉주 마라톤, 6/28 첫 개최",reviewed,6/28 인천대학교 송도캠퍼스. 10km
2026-04-30-03,2026-04-30,yes,korea,event,지중해마을 라이트런 6/13 아산 야간 개최…5월 1일 접수 오픈,"2026 지중해마을 라이트런이 6월 13일 충남 아산시 지중해마을 광장에서 열립니다. 10km, 5km, 1.2km 종목으로 안내되어 있으며, 접수는 5월 1일 시작해 6월 5일까지 진행됩니다.",발행 다음 날 접수가 열리는 후보라 바로 알림을 걸어둘 수 있습니다. 야간 러닝과 지역 축제 분위기를 함께 원하는 러너에게 맞는 대회입니다.,https://bluecrystalmarathon.imweb.me/,지중해마을 라이트런 공식,,"아산 야간 러닝, 5/1 접수 오픈",reviewed,공식 홈페이지 bluecrystalmarathon.imweb.me 200 OK 확인. 기존 lightrun2026.imweb.me는 404.
2026-04-30-03,2026-04-30,yes,global,elite,Korir 보스턴마라톤 2:01:52 코스 신기록…15년 만의 경신,"4월 20일 열린 2026 보스턴 마라톤에서 케냐의 존 코리르가 2시간 1분 52초로 우승하며 코스 기록을 새로 썼습니다. 2011년 제프리 무타이가 세운 2:03:02를 넘어선 기록이며, 여자부에서는 샤론 로케디가 2:18:51로 2연패했습니다.",보스턴은 언덕과 포인트투포인트 코스 특성 때문에 기록이 쉽지 않은 대회입니다. 2:01대 코스 기록은 엘리트 레이스 수준과 슈즈, 페이스 흐름을 함께 볼 수 있는 신호입니다.,https://worldathletics.org/news/report/korir-lokedi-course-record-boston-marathon,World Athletics,2026-04-20,코리르 보스턴 코스 신기록 2:01:52,reviewed
2026-04-30-03,2026-04-30,yes,global,gear,나이키 페가수스 42 출시…에너지 리턴 15% 향상, 4월 9일 발매,"나이키가 페가수스 42를 4월 9일 출시했습니다. 이번 모델은 곡선형 풀렝스 Air Zoom 유닛을 적용해 이전 모델보다 에너지 리턴을 15% 높였고, 일상 훈련부터 커뮤니티 런까지 폭넓게 쓰는 데 초점을 맞췄습니다.",페가수스는 국내 러너도 많이 신는 대표 데일리 트레이너입니다. 고가 레이스화가 부담스러운 러너라면 일상 훈련화 변화가 실제 구매 판단에 더 직접적으로 연결됩니다.,https://about.nike.com/en/newsroom/releases/nike-pegasus-42-official-images,Nike 공식,2026-02-24,"페가수스 42, 풀렝스 Air Zoom 적용",reviewed
2026-05-02-04,2026-05-02,yes,korea,event,IRON RUN 2026 포항 영일대 7월 4일 개최…5천 명 선착순,"IRON RUN 2026은 7월 4일 포항 영일대해수욕장 장미광장 일원에서 열립니다. 공식 대회요강 기준 출발은 오전 8시, 모집은 선착순 5,000명이며 접수는 5월 31일 18:00까지입니다. 코스는 3.8km, 7.87km, 15.38km 세 가지로, 일반적인 5km, 10km 구성이 아니라 아이언맨 거리에서 착안한 숫자를 러닝 이벤트로 바꾼 점이 특징입니다.","이 대회는 기록형 로드 레이스보다 콘셉트형 여름 러닝에 가깝습니다. 7월 포항 해변이라는 조건상 참가 여부를 정할 때 거리보다 기온, 급수, 이동 동선, 완주 후 회복 계획을 먼저 봐야 합니다. 10km 다음 목표를 찾는 러너에게는 15.38km가 부담은 있지만 기억에 남는 중간 단계가 될 수 있습니다.",https://www.ironrun.kr/ko/sub1_1.html,IRON RUN 공식,2026-05-02,"아이언런 7/4 포항, 접수 5/31까지",reviewed,"공식 대회요강 확인. 7/4 08:00 출발, 포항 영일대해수욕장 장미광장. 선착순 5000명, 5/31 18:00 접수 마감. 3.8km 25000원, 7.87km 35000원, 15.38km 40000원. 메인 스토리용으로 요약/코멘트 확장."
2026-05-02-04,2026-05-02,yes,korea,event,큰별 나눔 마라톤 6월 27일 상암 개최…접수 6월 7일까지,"2026 큰별 나눔 마라톤은 6월 27일 상암 월드컵공원 평화광장에서 열리는 하프, 10km, 5km 대회입니다. 공개 일정에는 3월 5일부터 6월 7일까지 접수, 전 종목 참가비 5만원, 넷타임 기록 측정과 물품보관소 운영이 안내돼 있습니다.",서울권 여름 초입 대회 중 접수 기간이 아직 남아 있는 후보입니다. 하프까지 열려 있어 10km에서 장거리로 넘어가는 러너에게 선택지가 됩니다.,https://bigstarrun.kr/,큰별 나눔 마라톤 공식,2026-05-02,"큰별 나눔 6/27 상암, 하프, 10km, 5km",reviewed,공식 홈페이지 bigstarrun.kr 확인. 수집 시 참고 출처는 김러닝이었으나 원문은 공식 사이트로 교체.
2026-05-02-04,2026-05-02,yes,korea,event,골드러시 5월 17일 미사 개최…완주자 대상 금 1돈 추첨,"러너블 홈 배너는 2026 골드러시를 “마지막 접수 중”으로 안내하며, 대회일은 5월 17일입니다. 공개 대회 정보에는 하남 미사경정공원에서 약 7,000명 규모로 열리고, 10km 8시, 11시 출발 선택지와 완주자 대상 순금 1돈 추첨 이벤트가 안내돼 있습니다.","기록만 노리는 대회가 아니라 이벤트형 10km라는 점이 다릅니다. 5월 중순 가까운 일정이라 참가자에게는 레이스 운영, 출발 시간 확인, 미참가자에게는 대회 콘셉트 트렌드를 짚어줄 수 있습니다.",https://runable.me/comp/3735,골드러시 공식,2026-05-02,"골드러시 5/17 미사, 완주 후 금 1돈 이벤트",reviewed,runable.me/comp/3735가 주최사 공식 페이지로 확인됨. 수집 시 참고 출처는 러너블이었으나 원문은 공식 이벤트 페이지로 교체.
2026-05-02-04,2026-05-02,yes,korea,event,양양 강변 전국마라톤 9월 12일 개최…남대천 코스 운영,"2026 양양 강변 전국마라톤은 9월 12일 강원 양양군 웰컴센터와 남대천 일원에서 열립니다. 공식 YRUN 사이트에는 2026년 접수 안내 공지가 올라와 있고, 공개 대회 정보에는 하프, 10km, 5km 운영과 G1방송, 양양군 주최가 안내돼 있습니다.",가을 장거리 시즌 전에 잡을 수 있는 강원권 로드 레이스입니다. 바다, 강변 러닝 여행 콘셉트가 있어 수도권 반복 대회와 다른 선택지를 줄 수 있습니다.,https://yrun.wizrun.com/notice/notice?stx=&sty=,양양 YRUN 공식,2026-02-25,"양양 YRUN 9/12, 남대천 강변 코스",reviewed
2026-05-02-04,2026-05-02,yes,global,news,"월드애슬레틱스, 2030년부터 단독 세계마라톤선수권 추진","월드애슬레틱스는 4월 7일 2030년부터 World Athletics Marathon Championships를 별도 대회로 도입하겠다는 로드맵을 발표했습니다. 2027년과 2029년 세계선수권까지는 마라톤이 기존 세계선수권 안에 남고, 2031년부터는 마라톤 등 도로 종목이 세계선수권 프로그램에서 빠지는 구상입니다.","마라톤이 트랙 중심 세계선수권의 한 종목에서 독립 이벤트로 커질 수 있다는 신호입니다. 메이저 대회, 국가대표 선발, 도로 러닝 팬덤의 구조가 장기적으로 바뀔 수 있습니다.",https://worldathletics.org/news/press-releases/athens-2030-world-marathon-championships,World Athletics,2026-04-07,2030년부터 마라톤 세계선수권 독립 추진,reviewed,"World Athletics 공식 보도자료 확인. Athens preferred host, annual standalone championships, 2031부터 WCH에서 도로 종목 제외 구상."
2026-05-05-05,2026-05-05,yes,korea,event,"한화생명 시그니처 63RUN, 5월 6일 티켓 예매 시작","한화생명은 5월 23일 여의도 63빌딩에서 시그니처 63RUN을 연다고 안내했습니다. 5월 6일부터 티켓 예매가 시작되며, 시그니처 1회 오르기와 챌린지 6회 오르기 2개 부문으로 총 500명을 모집합니다.",일반 로드 레이스와 다른 수직 마라톤이라 짧은 시간에 강한 운동 자극을 원하는 러너에게 맞습니다. 예매 기간이 짧고 모집 인원도 적어 관심 있다면 5월 6일 알림을 걸어둘 필요가 있습니다.,https://www.hankyung.com/article/202604278188P,한국경제/한화생명,2026-04-27,"63RUN 티켓 5/6 오픈, 총 500명 모집.",reviewed,한국경제 보도자료와 KorMarathon 일정 교차 확인.
2026-05-05-05,2026-05-05,no,korea,event,"안양천 장미꽃 축제 마라톤, 5월 14일까지 접수","2026 안양천 장미꽃 축제 마라톤은 5월 23일 신정교 하부 영롱이 억새구장에서 열립니다. 공식 대회요강 기준 하프는 08:00, 10km는 08:15, 5km는 08:45에 출발하며 접수는 5월 14일까지입니다.",서울 서남권에서 접근하기 쉬운 도심 하천 코스입니다. 환불 신청 기준일과 택배 수령지 변경 마감이 따로 있어 접수 전 운영 공지를 같이 확인해야 합니다.,https://roserun.kr/info/,안양천 장미꽃 축제 마라톤 공식,2026-05-04,"안양천 장미런, 접수 5/14까지.",reviewed,공식 대회요강
2026-05-05-05,2026-05-05,yes,korea,event,"커피 빵빵런, 5월 9~10일 강릉 개최…일부 10K 그룹 잔여","커피 빵빵런2026은 5월 9~10일 강릉 경포호수광장에서 열리는 5km, 10km 러닝 이벤트입니다. 공식 페이지 기준 10km는 5월 10일 일부 그룹 참가권이 남아 있고, 참가비는 10km 5만9천원입니다.",주말 여행형 레이스를 찾는 러너에게 강릉 코스와 지역 먹거리 콘셉트가 분명한 선택지입니다. 잔여 그룹이 제한적이라 일정이 맞는지 먼저 확인해야 합니다.,https://coffeebbangrun.com/shop_view?idx=350,커피 빵빵런 공식,2026-05-04,"강릉 커피 빵빵런, 5/10 일부 그룹 잔여.",reviewed,공식 대회소개와 10K 참가권 페이지 교차 확인.
2026-05-05-05,2026-05-05,yes,korea,event,"윙스 포 라이프 월드런 부천, 5월 10일 밤 8시 동시 출발","Wings for Life World Run 부천 App Run은 5월 10일 20:00 부천종합운동장에서 출발합니다. 공식 안내 기준 Virtual Catcher Car가 출발 30분 뒤 14km/h로 추격을 시작하고, 참가비와 기부금은 척수 손상 연구에 사용됩니다.",정해진 결승선 없이 캐처카에게 잡힐 때까지 달리는 방식이라 초보 러너도 자기 페이스로 참여할 수 있습니다. 오프라인 부천 참가와 앱 참가를 고를 수 있어 접근성이 좋습니다.,https://www.wingsforlifeworldrun.com/en/locations/bucheon,Wings for Life World Run 공식,2026-05-04,"윙스런 부천 5/10 20:00, 캐처카 방식.",reviewed,공식 Bucheon App Run 페이지 확인.
2026-05-05-05,2026-05-05,no,korea,event,"서울 유아차 레이스, 5월 10일 어린이대공원 개최",2026 서울 유아차 레이스 with 신한 20+뛰어요는 5월 10일 서울 어린이대공원에서 열리는 가족형 러닝 이벤트입니다. 보도에 따르면 영유아 및 미취학 자녀를 둔 가족이 유아차를 이용해 함께 걷거나 달리는 방식으로 진행됩니다.,러닝을 기록 경쟁이 아니라 가족 야외활동으로 확장하는 사례입니다. 아이와 함께 움직이는 러너에게는 대회장 동선과 준비물을 미리 점검할 만한 소식입니다.,https://news.nate.com/view/20260430n27809,키즈맘뉴스/네이트,2026-04-30,"서울 유아차 레이스 5/10, 가족형 러닝.",reviewed,보도자료와 공개 대회정보 교차 확인.
2026-05-05-05,2026-05-05,yes,korea,event,"시골'S런 양주 꿀런, 5월 8일 접수 마감","스파인더 공식 대회 페이지 기준 시골'S런 양주 꿀런은 5월 16일 10:30 양주 나리농원에서 열립니다. 3km와 5km 종목으로 운영되며 참가비는 3만5천원, 접수는 5월 8일까지입니다.",기록형 대회보다 꽃길, 피크닉, 지역 농가 상생을 앞세운 체험형 러닝입니다. 짧은 거리라 입문자나 가족 러너가 부담 없이 선택할 수 있습니다.,https://www.sfinder.co.kr/contest/contest_info/390,스파인더 공식,2026-05-04,"양주 꿀런 접수 5/8 마감, 3km, 5km."
2026-05-05-05,2026-05-05,no,korea,event,"독도수호 동호인마라톤, 5월 6일 접수 마감","2026년 독도 수호를 위한 동호인마라톤대회는 5월 31일 경주 서천 체육공원에서 열립니다. 공개 일정 기준 접수는 5월 6일까지이며 10km, 하프, 혼성릴레이 28km 종목이 안내돼 있습니다.",접수 마감이 발행 다음 날이라 놓치기 쉬운 지역 동호인 대회입니다. 릴레이 종목이 있어 개인 기록보다 팀 단위 참가를 원하는 러너에게 맞습니다.,https://kimrunning.com/marathon/111/list,김러닝,2026-05-04,독도수호 동호인마라톤 접수 5/6 마감.,reviewed,김러닝 일정과 KorMarathon 공식 웹사이트 링크 교차 확인.
2026-05-05-05,2026-05-05,no,korea,event,"마인드마라톤, 6월 7일 서울광장서 1만 명 규모 기부 레이스",마인드마라톤 공식 페이지는 6월 7일 서울광장에서 아동, 청소년 마음건강을 응원하는 1만 명 규모 기부 마라톤을 연다고 안내합니다. 참가비 전액은 마음건강 관련 NGO에 기부되는 구조입니다.,"대회 참가가 기부와 연결되는 사례라, 러너가 레이스 선택 기준을 기록뿐 아니라 사회적 메시지로 넓혀볼 수 있습니다. 서울 도심 대회라 접근성도 좋습니다.",https://mindmarathon.kr/,마인드마라톤 공식,2026-05-04,"마인드마라톤 6/7 서울광장, 참가비 전액 기부.",reviewed
2026-05-05-05,2026-05-05,no,global,event,"제네바 마라톤, 5월 9~10일 20회 대회 개최","Generali Geneva Marathon은 5월 9~10일 열리며 2026년에 20회째를 맞습니다. 공식 페이지는 마라톤을 포함해 여러 종목이 운영되는 주말형 대회라고 안내하고, 스위스에서 빠른 코스로 알려진 대회라는 점을 강조합니다.",유럽 봄 마라톤 원정을 보는 러너에게 일정과 대회 성격을 비교할 만한 기준이 됩니다. 런던 이후 5월 유럽 레이스 흐름을 이어서 보기 좋습니다.,https://www.generaligenevemarathon.com/en,Generali Geneva Marathon 공식,2026-05-04,"제네바마라톤 5/9~10, 20회째 개최.",reviewed,공식 대회 홈페이지 확인.
2026-05-05-05,2026-05-05,yes,global,elite,"프라하마라톤, Berehanu 2:05:51 우승…Jelimo 여자부 정상",Prague Daily News 보도에 따르면 5월 3일 열린 31회 Vodafone Prague Marathon에서 에티오피아의 Wendemu Tsegu Berehanu가 2시간 5분 51초로 우승했습니다. 여자부는 Millicent Jelimo가 2시간 24분 19초로 정상에 올랐습니다.,런던 이후 이어진 유럽 봄 마라톤의 엘리트 흐름을 볼 수 있는 결과입니다. 코스 기록에 근접한 남자 우승 기록은 빠른 도심 코스와 페이스 운영을 비교하는 데 참고가 됩니다.,https://www.praguedaily.news/2026/05/03/vodafone-prague-marathon-2026-ethiopian-berehanu-wins-in-2-05-51-havlena-again-czech-champion/,Prague Daily News,2026-05-03,"프라하마라톤 남자 2:05:51, 여자 2:24:19.",reviewed,Prague Daily News 결과 기사 확인.
